{
  "current_objective": "Improve aq-chat local recommendation quality with deterministic snapshot grounding and tool-loop bypass.",
  "phase": "Phase 148 — agentic standardization integration",
  "todo_snapshot": [
    "DONE: Phase 141 — RAGAS context_precision + faithfulness payload-nested fix (0f235363)",
    "DONE: Phase 142 — P2 contradiction detection at query time (6b321b4e)",
    "DONE: Phase 143 — RAGAS 4b panel in aq-report (0610441b)",
    "DONE: Phase 144 — format_json ragas_metrics dedup + P2 parity plan closure (05c11384)",
    "DONE: Phase 145 — dashboard caller identity coverage panel in query traces widget (2ed34de8)",
    "DONE: Phase 146 — aq-qa identity coverage checks 146.1-146.4 in phase0.py + _aq-qa-bash",
    "DONE: Phase 147 — dashboard health-spider semantic probes + auto-remediate health-spider pass + passive firewall sudo suppression",
    "DONE: Phase 147 rebuild was attempted by user; user then reverted a later build due desktop cursor/text input instability",
    "DONE: Phase 148 research pass identified aq-chat enable_thinking=true contradiction, thin golden eval coverage, stale parity/routing docs, multi-document YAML parser traps, and COSMIC input log signals",
    "DONE: Rebuild watch found and repo-fixed ai-auto-remediate PRSI queue command drift, tmpfiles unsafe transitions, health-spider already-covered AppArmor false-positive exit, and dashboard /tmp AppArmor directory denial",
    "DONE: sudo nixos-rebuild switch --flake .#hyperd-ai-dev activated Nix/AppArmor/service-copy changes",
    "DONE: Gemini direct edits changed aq-chat local payloads to enable_thinking=false and added first-pass multi-document YAML loader support",
    "DONE: Codex integration review repaired RESUME.json, hardened YAML loader edge cases, added Python aq-qa 0.10.1 coverage, and fixed local model config drift",
    "DONE: Focused validation passed: json.tool RESUME, py_compile touched Python, gate-local-payload-discipline, test-local-agent-config, diff --check, aq-qa 0 --machine 94/0/2",
    "DONE: User rebuilt and activated commit df78604a; post-rebuild aq-qa 0 --machine passed 94/0/2 and health-spider was clean",
    "DONE: Fixed continuation routing regression so continuation/general local tasks stay on the canonical default lane and user rebuild activated commit a23e1e24",
    "DONE: User post-rebuild validation passed aq-qa 0 --machine with 96/0/0 and aq-health-spider --once clean",
    "DONE: Corrected ai-post-deploy-converge service PATH fix committed in eeb47e49; prior git addition had landed in the npm security monitor path",
    "DONE: User rebuilt eeb47e49; live ai-post-deploy-converge PATH now includes git, no failed units, aq-alerts count 0, aq-qa 0 --machine passed 94/0/2 with report-backed checks skipped, and aq-health-spider --once clean",
    "DONE: aq-chat rendering fix committed in 1db804c8; local-tool-calling now renders completed JSON responses once",
    "DONE: Identified follow-up quality gap: operational recommendation prompts exhausted the local tool budget and could turn tool failures into false current-state claims",
    "DONE: Patched aq-chat to build trusted local preflight snapshots for improvement/health/status prompts and bypass the local tool loop for those turns",
    "DONE: Snapshot-grounded turns now call the raw local model with stream=false and max_tokens=512 using explicit evidence-only answer constraints",
    "DONE: Focused validation passed: py_compile, test-aq-chat-local-tool-profile.py, gate-local-payload-discipline.sh, import-level snapshot smoke, live aq-chat smoke with HAS_BUDGET_EXHAUSTED False",
    "PENDING: run tier0 pre-commit gate and commit aq-chat snapshot grounding fix"
  ],
  "uncommitted_changes": [
    ".agent/collaboration/RESUME.json",
    ".agent/memory/issues-backlog.md",
    ".agent/collaboration/HANDOFF.md",
    ".agent/collaboration/PULSE.log",
    ".agents/telemetry/routing-decisions.jsonl",
    "scripts/ai/aq-chat",
    "scripts/testing/test-aq-chat-local-tool-profile.py"
  ],
  "resume_hint": "aq-chat snapshot grounding fix is in repo: operational recommendation prompts get trusted local preflight evidence, bypass local-tool-calling tool loops, and use stream=false/max_tokens=512. Focused validation passed including live smoke with HAS_BUDGET_EXHAUSTED False. Next: tier0 pre-commit gate and commit."
}
